{
    "componentChunkName": "component---src-templates-blog-article-blog-page-template-tsx",
    "path": "/blog/2021/08/21/ofdm-subcarriers-rb-in-4g-lte-and-5g",
    "result": {"data":{"mdx":{"frontmatter":{"title":"Orthogonal Frequency Division Multiplexing (OFDM), Subcarriers, Resource Blocks and more in 4G and 5G","description":"OFDM allows multiple subcarriers within resource blocks to overlap significantly while producing little to no interference, allowing 5G to use its frequency allocation far more effectively.","path":"2021/08/21/ofdm-subcarriers-rb-in-4g-lte-and-5g","redirect_from":null,"created_at":"21 August 2021 16:00","updated_at":null,"created_at_iso":"2021-08-21T16:00Z","updated_at_iso":null,"archived":null},"id":"233909e5-5d3e-53bc-b5c1-f448c5f50481","body":"var _excluded = [\"components\"];\n\nfunction _extends() { _extends = Object.assign || function (target) { for (var i = 1; i < arguments.length; i++) { var source = arguments[i]; for (var key in source) { if (Object.prototype.hasOwnProperty.call(source, key)) { target[key] = source[key]; } } } return target; }; return _extends.apply(this, arguments); }\n\nfunction _objectWithoutProperties(source, excluded) { if (source == null) return {}; var target = _objectWithoutPropertiesLoose(source, excluded); var key, i; if (Object.getOwnPropertySymbols) { var sourceSymbolKeys = Object.getOwnPropertySymbols(source); for (i = 0; i < sourceSymbolKeys.length; i++) { key = sourceSymbolKeys[i]; if (excluded.indexOf(key) >= 0) continue; if (!Object.prototype.propertyIsEnumerable.call(source, key)) continue; target[key] = source[key]; } } return target; }\n\nfunction _objectWithoutPropertiesLoose(source, excluded) { if (source == null) return {}; var target = {}; var sourceKeys = Object.keys(source); var key, i; for (i = 0; i < sourceKeys.length; i++) { key = sourceKeys[i]; if (excluded.indexOf(key) >= 0) continue; target[key] = source[key]; } return target; }\n\n/* @jsxRuntime classic */\n\n/* @jsx mdx */\nvar _frontmatter = {\n  \"title\": \"Orthogonal Frequency Division Multiplexing (OFDM), Subcarriers, Resource Blocks and more in 4G and 5G\",\n  \"description\": \"OFDM allows multiple subcarriers within resource blocks to overlap significantly while producing little to no interference, allowing 5G to use its frequency allocation far more effectively.\",\n  \"path\": \"2021/08/21/ofdm-subcarriers-rb-in-4g-lte-and-5g\",\n  \"created_at\": \"2021-08-21T16:00Z\"\n};\n\nvar makeShortcode = function makeShortcode(name) {\n  return function MDXDefaultShortcode(props) {\n    console.warn(\"Component \" + name + \" was not imported, exported, or provided by MDXProvider as global scope\");\n    return mdx(\"div\", props);\n  };\n};\n\nvar TableOfContents = makeShortcode(\"TableOfContents\");\nvar layoutProps = {\n  _frontmatter: _frontmatter\n};\nvar MDXLayout = \"wrapper\";\nreturn function MDXContent(_ref) {\n  var components = _ref.components,\n      props = _objectWithoutProperties(_ref, _excluded);\n\n  return mdx(MDXLayout, _extends({}, layoutProps, props, {\n    components: components,\n    mdxType: \"MDXLayout\"\n  }), mdx(TableOfContents, _extends({}, props, {\n    mdxType: \"TableOfContents\"\n  })), mdx(\"p\", null, \"Orthogonal Frequency Division Multiplexing (more simply referred to as OFDM) allows multiple signals to overlap significantly while producing\\nlittle to no interference. It supercedes Frequency Division Multiplexing (FDM), where signals do not overlap, and require a spacer (guard band)\\nbetween them.\"), mdx(\"h2\", {\n    \"id\": \"subcarriers\",\n    \"style\": {\n      \"position\": \"relative\"\n    }\n  }, mdx(\"a\", {\n    parentName: \"h2\",\n    \"href\": \"#subcarriers\",\n    \"aria-label\": \"subcarriers permalink\",\n    \"className\": \"heading-link before\"\n  }, mdx(\"svg\", {\n    parentName: \"a\",\n    \"aria-hidden\": \"true\",\n    \"focusable\": \"false\",\n    \"height\": \"16\",\n    \"version\": \"1.1\",\n    \"viewBox\": \"0 0 16 16\",\n    \"width\": \"16\"\n  }, mdx(\"path\", {\n    parentName: \"svg\",\n    \"fillRule\": \"evenodd\",\n    \"d\": \"M4 9h1v1H4c-1.5 0-3-1.69-3-3.5S2.55 3 4 3h4c1.45 0 3 1.69 3 3.5 0 1.41-.91 2.72-2 3.25V8.59c.58-.45 1-1.27 1-2.09C10 5.22 8.98 4 8 4H4c-.98 0-2 1.22-2 2.5S3 9 4 9zm9-3h-1v1h1c1 0 2 1.22 2 2.5S13.98 12 13 12H9c-.98 0-2-1.22-2-2.5 0-.83.42-1.64 1-2.09V6.25c-1.09.53-2 1.84-2 3.25C6 11.31 7.55 13 9 13h4c1.45 0 3-1.69 3-3.5S14.5 6 13 6z\"\n  }))), \"Subcarriers\"), mdx(\"p\", null, \"In 5G NR and 4G LTE, the individual signals that are multiplexed using OFDM are called subcarriers. These subcarriers act as individual channels\\nwhich are used to transmit and receive data.\"), mdx(\"p\", null, \"Each subcarrier is assigned a specific frequency within the LTE or 5G NR band. In LTE, subcarriers are always spaced 15 KHz apart. In 5G, the\\nspacing is flexible (either 15 kHz, 30 kHz, 60 kHz, 120 kHz, 240 kHz, 480 kHz) to allow for a vast range of use cases.\"), mdx(\"h2\", {\n    \"id\": \"resource-blocks-rbs\",\n    \"style\": {\n      \"position\": \"relative\"\n    }\n  }, mdx(\"a\", {\n    parentName: \"h2\",\n    \"href\": \"#resource-blocks-rbs\",\n    \"aria-label\": \"resource blocks rbs permalink\",\n    \"className\": \"heading-link before\"\n  }, mdx(\"svg\", {\n    parentName: \"a\",\n    \"aria-hidden\": \"true\",\n    \"focusable\": \"false\",\n    \"height\": \"16\",\n    \"version\": \"1.1\",\n    \"viewBox\": \"0 0 16 16\",\n    \"width\": \"16\"\n  }, mdx(\"path\", {\n    parentName: \"svg\",\n    \"fillRule\": \"evenodd\",\n    \"d\": \"M4 9h1v1H4c-1.5 0-3-1.69-3-3.5S2.55 3 4 3h4c1.45 0 3 1.69 3 3.5 0 1.41-.91 2.72-2 3.25V8.59c.58-.45 1-1.27 1-2.09C10 5.22 8.98 4 8 4H4c-.98 0-2 1.22-2 2.5S3 9 4 9zm9-3h-1v1h1c1 0 2 1.22 2 2.5S13.98 12 13 12H9c-.98 0-2-1.22-2-2.5 0-.83.42-1.64 1-2.09V6.25c-1.09.53-2 1.84-2 3.25C6 11.31 7.55 13 9 13h4c1.45 0 3-1.69 3-3.5S14.5 6 13 6z\"\n  }))), \"Resource blocks (RBs)\"), mdx(\"blockquote\", null, mdx(\"p\", {\n    parentName: \"blockquote\"\n  }, mdx(\"undefined\", {\n    parentName: \"p\"\n  }, mdx(\"img\", {\n    \"className\": \"emoji\",\n    \"draggable\": \"false\",\n    \"alt\": \"⚠️\",\n    \"src\": \"https://twemoji.maxcdn.com/v/14.0.2/72x72/26a0.png\",\n    \"title\": \"⚠️\"\n  }), \" This section is written specifically about 4G LTE. These facts may not be completely accurate for 5G. Please perform your own research.\"))), mdx(\"p\", null, \"The number of subcarriers depends on the number of resource blocks (RBs) available, which itself depends upon the bandwidth available.\"), mdx(\"p\", null, mdx(\"strong\", {\n    parentName: \"p\"\n  }, \"Every RB contains 12 subcarriers.\"), \" This is fixed and never changes.\"), mdx(\"div\", {\n    className: \"narrow\"\n  }, mdx(\"table\", null, mdx(\"thead\", {\n    parentName: \"table\"\n  }, mdx(\"tr\", {\n    parentName: \"thead\"\n  }, mdx(\"th\", {\n    parentName: \"tr\",\n    \"align\": \"center\"\n  }, \"Bandwidth\"), mdx(\"th\", {\n    parentName: \"tr\",\n    \"align\": \"center\"\n  }, \"RBs\"), mdx(\"th\", {\n    parentName: \"tr\",\n    \"align\": \"center\"\n  }, \"Subcarriers\"))), mdx(\"tbody\", {\n    parentName: \"table\"\n  }, mdx(\"tr\", {\n    parentName: \"tbody\"\n  }, mdx(\"td\", {\n    parentName: \"tr\",\n    \"align\": \"center\"\n  }, \"1.4 MHz\"), mdx(\"td\", {\n    parentName: \"tr\",\n    \"align\": \"center\"\n  }, \"6\"), mdx(\"td\", {\n    parentName: \"tr\",\n    \"align\": \"center\"\n  }, \"72\")), mdx(\"tr\", {\n    parentName: \"tbody\"\n  }, mdx(\"td\", {\n    parentName: \"tr\",\n    \"align\": \"center\"\n  }, \"3 MHz\"), mdx(\"td\", {\n    parentName: \"tr\",\n    \"align\": \"center\"\n  }, \"15\"), mdx(\"td\", {\n    parentName: \"tr\",\n    \"align\": \"center\"\n  }, \"180\")), mdx(\"tr\", {\n    parentName: \"tbody\"\n  }, mdx(\"td\", {\n    parentName: \"tr\",\n    \"align\": \"center\"\n  }, \"5 MHz\"), mdx(\"td\", {\n    parentName: \"tr\",\n    \"align\": \"center\"\n  }, \"25\"), mdx(\"td\", {\n    parentName: \"tr\",\n    \"align\": \"center\"\n  }, \"375\")), mdx(\"tr\", {\n    parentName: \"tbody\"\n  }, mdx(\"td\", {\n    parentName: \"tr\",\n    \"align\": \"center\"\n  }, \"10 MHz\"), mdx(\"td\", {\n    parentName: \"tr\",\n    \"align\": \"center\"\n  }, \"50\"), mdx(\"td\", {\n    parentName: \"tr\",\n    \"align\": \"center\"\n  }, \"600\")), mdx(\"tr\", {\n    parentName: \"tbody\"\n  }, mdx(\"td\", {\n    parentName: \"tr\",\n    \"align\": \"center\"\n  }, \"15 MHz\"), mdx(\"td\", {\n    parentName: \"tr\",\n    \"align\": \"center\"\n  }, \"75\"), mdx(\"td\", {\n    parentName: \"tr\",\n    \"align\": \"center\"\n  }, \"975\")), mdx(\"tr\", {\n    parentName: \"tbody\"\n  }, mdx(\"td\", {\n    parentName: \"tr\",\n    \"align\": \"center\"\n  }, \"20 MHz\"), mdx(\"td\", {\n    parentName: \"tr\",\n    \"align\": \"center\"\n  }, \"100\"), mdx(\"td\", {\n    parentName: \"tr\",\n    \"align\": \"center\"\n  }, \"1200\"))))), mdx(\"h3\", {\n    \"id\": \"symbols\",\n    \"style\": {\n      \"position\": \"relative\"\n    }\n  }, mdx(\"a\", {\n    parentName: \"h3\",\n    \"href\": \"#symbols\",\n    \"aria-label\": \"symbols permalink\",\n    \"className\": \"heading-link before\"\n  }, mdx(\"svg\", {\n    parentName: \"a\",\n    \"aria-hidden\": \"true\",\n    \"focusable\": \"false\",\n    \"height\": \"16\",\n    \"version\": \"1.1\",\n    \"viewBox\": \"0 0 16 16\",\n    \"width\": \"16\"\n  }, mdx(\"path\", {\n    parentName: \"svg\",\n    \"fillRule\": \"evenodd\",\n    \"d\": \"M4 9h1v1H4c-1.5 0-3-1.69-3-3.5S2.55 3 4 3h4c1.45 0 3 1.69 3 3.5 0 1.41-.91 2.72-2 3.25V8.59c.58-.45 1-1.27 1-2.09C10 5.22 8.98 4 8 4H4c-.98 0-2 1.22-2 2.5S3 9 4 9zm9-3h-1v1h1c1 0 2 1.22 2 2.5S13.98 12 13 12H9c-.98 0-2-1.22-2-2.5 0-.83.42-1.64 1-2.09V6.25c-1.09.53-2 1.84-2 3.25C6 11.31 7.55 13 9 13h4c1.45 0 3-1.69 3-3.5S14.5 6 13 6z\"\n  }))), \"Symbols\"), mdx(\"p\", null, \"In LTE, each subcarrier can carry 15 thousand symbols per second (15 ksps).\"), mdx(\"p\", null, \"A symbol is a unit of data consisting of one or more bits. The number of bits depends on how the symbol is encoded.\"), mdx(\"div\", {\n    className: \"narrow\"\n  }, mdx(\"table\", null, mdx(\"thead\", {\n    parentName: \"table\"\n  }, mdx(\"tr\", {\n    parentName: \"thead\"\n  }, mdx(\"th\", {\n    parentName: \"tr\",\n    \"align\": \"center\"\n  }, \"Encoding Method\"), mdx(\"th\", {\n    parentName: \"tr\",\n    \"align\": \"center\"\n  }, \"Bits per symbol\"))), mdx(\"tbody\", {\n    parentName: \"table\"\n  }, mdx(\"tr\", {\n    parentName: \"tbody\"\n  }, mdx(\"td\", {\n    parentName: \"tr\",\n    \"align\": \"center\"\n  }, \"QPSK (4 QAM)\"), mdx(\"td\", {\n    parentName: \"tr\",\n    \"align\": \"center\"\n  }, \"2 bits per symbol\")), mdx(\"tr\", {\n    parentName: \"tbody\"\n  }, mdx(\"td\", {\n    parentName: \"tr\",\n    \"align\": \"center\"\n  }, \"16 QAM\"), mdx(\"td\", {\n    parentName: \"tr\",\n    \"align\": \"center\"\n  }, \"4 bits per symbol\")), mdx(\"tr\", {\n    parentName: \"tbody\"\n  }, mdx(\"td\", {\n    parentName: \"tr\",\n    \"align\": \"center\"\n  }, \"64 QAM\"), mdx(\"td\", {\n    parentName: \"tr\",\n    \"align\": \"center\"\n  }, \"6 bits per symbol\")), mdx(\"tr\", {\n    parentName: \"tbody\"\n  }, mdx(\"td\", {\n    parentName: \"tr\",\n    \"align\": \"center\"\n  }, \"256 QAM\"), mdx(\"td\", {\n    parentName: \"tr\",\n    \"align\": \"center\"\n  }, \"8 bits per symbol\"))))), mdx(\"figure\", {\n    role: \"group\"\n  }, mdx(MathBlock, {\n    title: \"Max throughput calculation\",\n    math: \"\\\\text{max throughput (bps)} = 15000 \\\\times \\\\text{subcarrier count} \\\\times \\\\text{bits per symbol}\",\n    mdxType: \"MathBlock\"\n  }), mdx(MathBlock, {\n    color: \"neutral\",\n    title: \"Example\",\n    footer: \"20 MHz (1200 subcarriers) at 256 QAM\",\n    math: \"1200 \\\\times 15000 \\\\times 8 = 144\\\\space\\\\text{Mbps}\",\n    mdxType: \"MathBlock\"\n  })), mdx(\"p\", null, \"It's extremely important to note that \", mdx(\"strong\", {\n    parentName: \"p\"\n  }, \"you will never see speeds this high in real-world usage\"), \". Not only are your sharing access to the\\nresource blocks with other users, but these calculations do not include any overhead that is present for coding and control purposes, etc.\"), mdx(FactBox, {\n    title: \"What's QAM?\",\n    mdxType: \"FactBox\"\n  }, mdx(\"p\", null, \"QAM stands for Quadrature Amplitude Modulation. It is a technique that uses a combination of two carrier signals on the same frequency, offset\\nfrom each other by 90 degrees, to encode multiple bits per symbol.\"), mdx(\"p\", null, \"Essentially, this allows you to fit up to 8 bits (256 QAM) into each symbol (a piece of encoded data) instead of just 1 or 2.\"), mdx(\"p\", null, \"A future article will go into greater depth on QAM.\")), mdx(\"h2\", {\n    \"id\": \"ofdm-in-practice\",\n    \"style\": {\n      \"position\": \"relative\"\n    }\n  }, mdx(\"a\", {\n    parentName: \"h2\",\n    \"href\": \"#ofdm-in-practice\",\n    \"aria-label\": \"ofdm in practice permalink\",\n    \"className\": \"heading-link before\"\n  }, mdx(\"svg\", {\n    parentName: \"a\",\n    \"aria-hidden\": \"true\",\n    \"focusable\": \"false\",\n    \"height\": \"16\",\n    \"version\": \"1.1\",\n    \"viewBox\": \"0 0 16 16\",\n    \"width\": \"16\"\n  }, mdx(\"path\", {\n    parentName: \"svg\",\n    \"fillRule\": \"evenodd\",\n    \"d\": \"M4 9h1v1H4c-1.5 0-3-1.69-3-3.5S2.55 3 4 3h4c1.45 0 3 1.69 3 3.5 0 1.41-.91 2.72-2 3.25V8.59c.58-.45 1-1.27 1-2.09C10 5.22 8.98 4 8 4H4c-.98 0-2 1.22-2 2.5S3 9 4 9zm9-3h-1v1h1c1 0 2 1.22 2 2.5S13.98 12 13 12H9c-.98 0-2-1.22-2-2.5 0-.83.42-1.64 1-2.09V6.25c-1.09.53-2 1.84-2 3.25C6 11.31 7.55 13 9 13h4c1.45 0 3-1.69 3-3.5S14.5 6 13 6z\"\n  }))), \"OFDM in practice\"), mdx(\"p\", null, \"As we mentioned earlier, OFDM is a technique that allows multiple signals to overlap significantly while producing little to no interference.\"), mdx(\"p\", null, \"In 4G LTE and 5G NR, these signals are subcarriers inside each resource block.\"), mdx(\"p\", null, mdx(\"img\", {\n    parentName: \"p\",\n    \"src\": \"/static/ofdm-3036d06f3ae3b68e1b7c9e820f93b78a.svg\",\n    \"alt\": \"Diagram of Orthogonal Frequency Division Multiplexing\"\n  })), mdx(\"p\", null, \"Each signal is spaced apart so that the peak of any one signal lines up perfectly with the spectrum nulls of all other signals. You can see this\\nby following the dotted lines in the diagram above from the peak down. This reduces the amount of interference from other subcarriers.\"), mdx(\"h3\", {\n    \"id\": \"4g-lte\",\n    \"style\": {\n      \"position\": \"relative\"\n    }\n  }, mdx(\"a\", {\n    parentName: \"h3\",\n    \"href\": \"#4g-lte\",\n    \"aria-label\": \"4g lte permalink\",\n    \"className\": \"heading-link before\"\n  }, mdx(\"svg\", {\n    parentName: \"a\",\n    \"aria-hidden\": \"true\",\n    \"focusable\": \"false\",\n    \"height\": \"16\",\n    \"version\": \"1.1\",\n    \"viewBox\": \"0 0 16 16\",\n    \"width\": \"16\"\n  }, mdx(\"path\", {\n    parentName: \"svg\",\n    \"fillRule\": \"evenodd\",\n    \"d\": \"M4 9h1v1H4c-1.5 0-3-1.69-3-3.5S2.55 3 4 3h4c1.45 0 3 1.69 3 3.5 0 1.41-.91 2.72-2 3.25V8.59c.58-.45 1-1.27 1-2.09C10 5.22 8.98 4 8 4H4c-.98 0-2 1.22-2 2.5S3 9 4 9zm9-3h-1v1h1c1 0 2 1.22 2 2.5S13.98 12 13 12H9c-.98 0-2-1.22-2-2.5 0-.83.42-1.64 1-2.09V6.25c-1.09.53-2 1.84-2 3.25C6 11.31 7.55 13 9 13h4c1.45 0 3-1.69 3-3.5S14.5 6 13 6z\"\n  }))), \"4G LTE\"), mdx(\"p\", null, \"In 4G LTE, OFDM is only used for downlink from phone masts (eNodeB's) to your device (UE's). It is not used for uplink from the UE to the eNodeB.\"), mdx(\"h4\", {\n    \"id\": \"uplink\",\n    \"style\": {\n      \"position\": \"relative\"\n    }\n  }, mdx(\"a\", {\n    parentName: \"h4\",\n    \"href\": \"#uplink\",\n    \"aria-label\": \"uplink permalink\",\n    \"className\": \"heading-link before\"\n  }, mdx(\"svg\", {\n    parentName: \"a\",\n    \"aria-hidden\": \"true\",\n    \"focusable\": \"false\",\n    \"height\": \"16\",\n    \"version\": \"1.1\",\n    \"viewBox\": \"0 0 16 16\",\n    \"width\": \"16\"\n  }, mdx(\"path\", {\n    parentName: \"svg\",\n    \"fillRule\": \"evenodd\",\n    \"d\": \"M4 9h1v1H4c-1.5 0-3-1.69-3-3.5S2.55 3 4 3h4c1.45 0 3 1.69 3 3.5 0 1.41-.91 2.72-2 3.25V8.59c.58-.45 1-1.27 1-2.09C10 5.22 8.98 4 8 4H4c-.98 0-2 1.22-2 2.5S3 9 4 9zm9-3h-1v1h1c1 0 2 1.22 2 2.5S13.98 12 13 12H9c-.98 0-2-1.22-2-2.5 0-.83.42-1.64 1-2.09V6.25c-1.09.53-2 1.84-2 3.25C6 11.31 7.55 13 9 13h4c1.45 0 3-1.69 3-3.5S14.5 6 13 6z\"\n  }))), \"Uplink\"), mdx(\"p\", null, \"For uplink, another frequency division method is used called Single Carrier Frequency-Division Multi Access (SC-FDMA). This is where the UE\\naccesses the full bandwidth of a whole resource block for one or more symbol periods (the time it takes to send a symbol -- approx. 66.7\\nmicroseconds for LTE). This allows multiple devices to share access to the uplink frequencies, which being more power-efficient than OFDM.\"), mdx(FactBox, {\n    title: \"Why not OFDM for uplink?\",\n    mdxType: \"FactBox\"\n  }, mdx(\"p\", null, \"When the 4G LTE specification was being created, power-efficiency was at the forefront of people's minds when designing the uplink. Most user\\nequipment (UE), such as phones, are battery-operated, so a trade-off was needed between speed and efficiency.\"), mdx(\"p\", null, \"The performance difference between SC-FDMA and OFDM is very small, however SC-FDMA is much more efficient, so is used in UE modems instead.\")), mdx(\"h3\", {\n    \"id\": \"5g-nr\",\n    \"style\": {\n      \"position\": \"relative\"\n    }\n  }, mdx(\"a\", {\n    parentName: \"h3\",\n    \"href\": \"#5g-nr\",\n    \"aria-label\": \"5g nr permalink\",\n    \"className\": \"heading-link before\"\n  }, mdx(\"svg\", {\n    parentName: \"a\",\n    \"aria-hidden\": \"true\",\n    \"focusable\": \"false\",\n    \"height\": \"16\",\n    \"version\": \"1.1\",\n    \"viewBox\": \"0 0 16 16\",\n    \"width\": \"16\"\n  }, mdx(\"path\", {\n    parentName: \"svg\",\n    \"fillRule\": \"evenodd\",\n    \"d\": \"M4 9h1v1H4c-1.5 0-3-1.69-3-3.5S2.55 3 4 3h4c1.45 0 3 1.69 3 3.5 0 1.41-.91 2.72-2 3.25V8.59c.58-.45 1-1.27 1-2.09C10 5.22 8.98 4 8 4H4c-.98 0-2 1.22-2 2.5S3 9 4 9zm9-3h-1v1h1c1 0 2 1.22 2 2.5S13.98 12 13 12H9c-.98 0-2-1.22-2-2.5 0-.83.42-1.64 1-2.09V6.25c-1.09.53-2 1.84-2 3.25C6 11.31 7.55 13 9 13h4c1.45 0 3-1.69 3-3.5S14.5 6 13 6z\"\n  }))), \"5G NR\"), mdx(\"p\", null, \"In 5G NR, OFDM is used for both uplink and downlink.\"), mdx(\"p\", null, \"Modern modems can transmit data much more efficiently then they could when 4G LTE was being finalised, meaning that OFDM can be used in both\\ndirections in modern devices.\"), mdx(\"p\", null, \"Its specific form of OFDM is called CP-OFDM (cyclical prefix OFDM), which is what allows for the use of differing subcarrier spacing.\"));\n}\n;\nMDXContent.isMDXComponent = true;","tableOfContents":{"items":[{"url":"#subcarriers","title":"Subcarriers"},{"url":"#resource-blocks-rbs","title":"Resource blocks (RBs)","items":[{"url":"#symbols","title":"Symbols"}]},{"url":"#ofdm-in-practice","title":"OFDM in practice","items":[{"url":"#4g-lte","title":"4G LTE"},{"url":"#5g-nr","title":"5G NR"}]}]},"excerpt":"Orthogonal Frequency Division Multiplexing (more simply referred to as OFDM) allows multiple signals to overlap significantly while…","timeToRead":2,"wordCount":{"words":652}}},"pageContext":{"id":"233909e5-5d3e-53bc-b5c1-f448c5f50481","page":1}},
    "staticQueryHashes": ["3360246512","63159454"]}